,상품명
100,호호바 오일
101,     퓨어 유기농 호호바 오일
102,오가닉 호호바 오일
103,자연산 냉압착 호호바 오일
104,굳세라 수퍼 세라마이드 에센셜 오일
105,골든 글로우 페이스 오일
106,프리미엄 호호바 오일
107,화이트 트러플 세럼 인 오일 드롭
108,슈퍼    바운스 씬 오일
109,냉압착 호호바 오일
110,스킨 이센셜즈 배리어 리페어 페이스 오일
111,액티브 브이 퍼스트 오일
112,아베이 로얄 유쓰 워터리 오일
113,아쿠아수르스 매직 젤 오일
114,스킨소스 타마누 오일
115,윌 프로디쥬스 멀티 리치 오일
116,프로폴리스 페이스오일
117,굳세라 수퍼 세라마이드 모이스춰 밤
118,페이스 트리트먼트 플랜트 오일 블루 오키드
119,오션 딥 블루오일
120,레이어드 커버 파운데이션  SPF   PA   
121,윙크 파운데이션 팩트  SPF    PA    
122,인텐시브 스킨 세럼 파운데이션  SPF   PA    
123,자생 퍼펙트 쿠션  SPF    PA     
124,매트 벨벳 스킨 블러링 파우더 파운데이션
125,아우라 워터 글로우 쿠션  SPF    PA    
126,퓨처리스트 아쿠아 브릴리언스 파운데이션  SPF   PA    
127,새틴 핏 레이어 쿠션  SPF   PA     
128,뗑 이돌 롱라스팅 파운데이션  SPF   PA   
129,퍼펙팅 파운데이션  SPF   PA  
130,커버리셔스 파워 핏 파운데이션  SPF   PA   
131,래디언스 퍼펙트핏 파운데이션  SPF   PA   
132,글로우 래스팅 파운데이션  SPF   PA   
133,더블 웨어 스테이 인 플레이스 메이크업  SPF   PA   
134,포에버 스킨 글로우   H 웨어 스킨 케어링 파운데이션  SPF   PA   
135,에센셜 스킨 누더 쿠션  SPF   PA   
136,아쿠아 글로우 쿠션 파운데이션  SPF   PA   
137,리부트 파운데이션
138,마이크로 글래시핏 쿠션  SPF    PA     
139,더 퍼스트 파운데이션  SPF   PA   
