,브랜상품
950,아비노 데일리 모이스춰라이징 로션
951,홀리카홀리카 굳세라 아토릴리프 오일 로션
952,바이오더마 아토덤 크림
953,러쉬 슬리피
954,암웨이 하이드레이팅 핸드 앤 바디로션
955,엘리자베스아덴 그린티 허니 드롭스 바디크림
956,뉴트로지나 노르웨이젼 포뮬러 바디 에멀젼
957,멜라루카 리뉴 인텐시브 스킨 로션
958,일리윤 울트라 리페어 로션
959,아비노 스트레스 릴리프 모이스처라이징 로션
960,바세린 퓨어 스킨 젤리 오리지널
961,헉슬리 바디 오일 모로칸 가드너
962,메디포포 레미디얼 크림
963,더마비 데일리 모이스처 바디 오일
964,더마비 마일드 모이스처 밀크 오일
965,김정문알로에큐어 플러스 크림
966,LUCAS PAPAW REMEDIES 포포크림
967,클라랑스 토닉 바디 트리트먼트 오일
968,아쿠아퍼 수딩 오인트먼트
969,로즈버드 퍼퓸 컴퍼니 로즈버드살브 오리지널
970,퓨어포레 센텔라 멀티 밤
971,ROSE & CO.로즈페탈 살브
972,록시땅 퓨어 시어 버터 EFT  에코서트
973,더바디샵 모링가 뷰티파잉 오일
974,버츠비 레몬 앤 비타민 E 바스 앤 바디 오일
975,비욘드 딥 모이스처 바디 오일
976,로즈버드 퍼퓸 컴퍼니 민트 로즈 튜브
977,아쿠아퍼 수딩 스킨 밤
978,록시땅 아몬드 서플 스킨 오일
979,꼬달리 디바인 오일
980,비욘드 딥 모이스처 바디 미스트
981,러쉬 트와일라잇
982,더프트앤도프트 스톡홀름로즈 파인프라그란스 헤어   바디미스트
983,바디홀릭 바디미스트  화이트포션 
984,빅토리아시크릿 바디미스트 아쿠아키스
985,바디판타지 웨딩데이 판타지 바디 스프레이
986,바디홀릭 핑크 포션
987,더바디샵 화이트 머스크 후레그런스 미스트
988,록시땅 시트러스 버베나 바디 스플래쉬
989,프라도어 바디 오 드 뚜왈렛   
