,브랜상품
250,입생로랑 탑 시크릿 메이크업 세팅 스프레이
251,메이크업포에버 미스트 앤 픽스
252,에스쁘아 페이스 프라임 글로우 픽스 미스트
253,어반디케이 칠 쿨링 앤 하이드레이팅 메이크업 세팅 스프레이
254,메리케이 메이크업 피니싱 스프레이
255,자트인사이트 울트라 세팅 진짜 픽서
256,어반디케이 여행용 체리 올나이터
257,투쿨포스쿨 아트클래스 익스트림 세팅 픽서
258,네이처리퍼블릭 프로방스 스마트 베리어 메이크업 픽서
259,아리따움 올데이 필터 픽서
260,바비브라운 럭스 립 칼라
261,투쿨포스쿨 글램락 미스티 로즈
262,랑콤 압솔뤼 루즈
263,투쿨포스쿨 글램락 허쉬 브라운
264,클리오 매드 매트 립
265,지방시 뷰티 르 루즈
266,바비브라운 너리싱 립 칼라
267,미샤 데어 루즈 벨벳
268,홀리카홀리카 누드롭 듀이스틱
269,조르지오아르마니 루즈 아르마니
270,비디보브 립컷 루즈 벨벳
271,라카 스무스 매트 립스틱
272,웨이크메이크 루즈 건 제로
273,랑콤 압솔뤼 루즈 드라마 마뜨
274,샤넬 루쥬 알뤼르
275,메이크업포에버 아티스트 루즈 매트
276,클리오 매드 매트 스테인 립
277,레어카인드 페이드 매트 립스틱
278,샤넬 루쥬 코코
279,샤넬 루쥬 코코 플래쉬
280,삐아 라스트 벨벳 립 틴트 
281,삐아 라스트 벨벳 립 틴트  
282,삐아 라스트 벨벳 립 틴트 
283,블랙루즈 에어 핏 벨벳틴트 
284,헤라 센슈얼 스파이시 누드 글로스
285,블랙루즈 에어 핏 벨벳틴트 
286,블랙루즈 에어 핏 벨벳틴트
287,입생로랑 베르니 아 레브르 바이닐 크림
288,어퓨 과즙팡 무스 틴트
289,KVD 비건뷰티 에버라스팅 리퀴드 립스틱
