,브랜상품
1100,유노하나 유노하나 파우더
1101,러쉬 더 컴포터
1102,플루 바디 밸런스 스크럽
1103,비욘드 토탈 리커버리 샤워크림
1104,플루 바디 밸런스 더 프리미엄 에디션
1105,러쉬 섹스 밤
1106,사봉 바디스크럽   로즈티
1107,러쉬 브라이트사이드
1108,온더바디 벨먼 내추럴 스파 사해소금 스크럽 바디워시
1109,비욘드 딥 모이스처 샤워 크림
1110,온더바디 스파 내추럴 테라피 블랙로즈 사해소금 스크럽 바디워시
1111,러쉬 써니사이드
1112,해피바스 스킨유 스킨에멀전 샤워젤
1113,러쉬 인터갈락틱
1114,사봉 바디스크럽   딜리케이트 자스민
1115,지오마 리모델링 스크럽
1116,일리윤 세라마이드 아토     탑투토워시
1117,지오마 이몰리언트 바디스크럽
1118,더바디샵 핑크 그레이프후룻 샤워젤
1119,지오마 피치코코 스크럽
1120,나인위시스 화이트 톤업 바디 세럼  SPF   
1121,겔랑 꼬끄 도르 퍼퓸드 쉬머 파우더 바디   헤어
1122,코스노리 샤이닝 드레스 크림
1123,오스트레일리안골드 코나커피 태닝로션 브론저  SPF   
1124,오샐런스 보데나 렉스 스프레이
1125,베네피트 훌라 제로 탠 라인 바디 브론저
1126,록시땅 피브완 플로라 쉬머링 오일
1127,페이스인페이스 원더렉스
1128,러쉬 쉼미 쉼미
1129,밀키드레스 더 샤인 바디밤
1130,베네피트 테이크 어 픽쳐 잇 래스트 롱거
1131,라네즈 스파클링 바디쿠션
1132,스키니탠    아워 브론저
1133,세포라 컬렉션 그래듀얼 셀프 태닝 바디 로션
1134,오스트레일리안골드 그래주얼 선레스 셀프태닝 로션
1135,세포라 컬렉션 글리터 하이라이터 글리터 젤
1136,부르조아 드 솔레일 브론징 페이스 바디 스프레이
1137,나스 모노이 바디 글로우 브론징 바디 오일
1138,펜티뷰티 바디 라바 바디 루미나이저
1139,러쉬 블랙 스타킹스
