,브랜상품
600,셀퓨전씨 파파야 그래뉼 필스
601,이니스프리 트루케어 칼라민     클렌저
602,SRB쌀뜨물 미강 효소 세안제
603,휘게 약산성 히알루론 젤 클렌저
604,프리메라 내추럴 리치 클렌징 폼
605,이즈앤트리 스팟 세이버 쑥 파우더 워시
606,애즈이즈투비 pH 밸런싱 젤 클렌저
607,해서린 모닝 듀 비타 클렌징젤
608,미샤 타임 레볼루션 개똥쑥 팩 폼 클렌저
609,닥터오라클 안티박 아크네 클렌징 폼
610,잇퍼 에브리데이 밸런싱 약산성 쑥쑥 클렌징폼
611,유리프 셋업 폼클렌저
612,라로슈포제 에빠끌라 딥 클렌징 포밍 크림
613,설화수 순행 클렌징 폼
614,시드물 엔자임 클렌징 젤 효소 클렌징 젤 
615,에이밀 슈퍼 그레인 버블 폼
616,메이크프렘 세이프 미 릴리프 모이스처 클렌징 폼
617,시드물 카카두 아미노 클렌져
618,룩스앤메이 아미노 버블 약산성 클렌저
619,러쉬 엔젤스 온 배어 스킨
620,더샘 힐링 티 가든 티트리 클렌징 워터
621,바닐라코 클린 잇 제로 클렌징 밤 오리지널
622,니베아 프로페셔널 미셀라에어 클렌징 워터
623,킵쿨 수드 피토 그린 샤워 클렌징 워터
624,더샘 힐링 티 가든 클렌징 코튼 패드
625,헤이미쉬 올 클린 밤
626,키노닉스 카모 클렌징 패드
627,라로슈포제 미셀라 클렌징워터 울트라 센시티브 스킨
628,더샘 힐링 티 가든 그린티 클렌징 워터
629,비페스타 클렌징 시트
630,비오투름 클렌징 밀크
631,가르니에 미셀라 클렌징 워터
632,브라운랩 애시드 밸런스 페이셜 클렌징 워터
633,크리니크 테이크 더 데이 오프 클렌징 오일
634,슈에무라 안티 폴루션 클렌징 오일
635,설화수 순행 클렌징 오일
636,세컨디자인 퍼스트 클렌징 오일 퓨어 앤 프레쉬
637,시드물 닥터트럽 스킨 리터닝 클렌징 밀크
638,16BRAND    만능 슈퍼 클렌징 밤
639,아리얼 스트레스 릴리빙 퓨어풀 립앤아이 리무버 패드
